{
  "schema_version": "fixed-input-slots/v1",
  "slot_order": [
    "source_video",
    "new_product_image",
    "new_model_image",
    "ui_screenshot",
    "app_store_url",
    "ui_operation_video",
    "tail_video"
  ],
  "admission": {
    "source_required": true,
    "source_present": true,
    "minimum_optional_slots": 1,
    "optional_present_count": 1,
    "can_proceed": true,
    "language_only": false,
    "change_input_present": true,
    "enabled_extension_present": false,
    "blocker_code": null
  },
  "slots": {
    "source_video": {
      "slot_id": "source_video",
      "role": "source_video",
      "kind": "video",
      "present": true,
      "valid": true,
      "source": "supplied",
      "values": [
        "C:\\Users\\zhaocx04\\AppData\\Local\\Temp\\简单剧情1.mp4"
      ],
      "sha256": [
        "2a9be63695117d6dfd733f970d13e8a2fee99530c97218d57f64732897e75df8"
      ]
    },
    "new_product_image": {
      "slot_id": "new_product_image",
      "role": "target_product_truth",
      "kind": "image",
      "present": false,
      "valid": true,
      "source": "absent",
      "values": [],
      "sha256": []
    },
    "new_model_image": {
      "slot_id": "new_model_image",
      "role": "target_character_truth",
      "kind": "image",
      "present": true,
      "valid": true,
      "source": "supplied",
      "values": [
        "C:\\Users\\zhaocx04\\Downloads\\ComfyUI_00001_texcx_1754979236.png"
      ],
      "sha256": [
        "4eb23167c62f44b78d0a94fb9504bddf580ccd8ad7d977b08f5739d075fde8d6"
      ]
    },
    "ui_screenshot": {
      "slot_id": "ui_screenshot",
      "role": "target_ui_truth",
      "kind": "image",
      "present": false,
      "valid": true,
      "source": "absent",
      "values": [],
      "sha256": []
    },
    "app_store_url": {
      "slot_id": "app_store_url",
      "role": "app_store_evidence",
      "kind": "url",
      "present": false,
      "valid": true,
      "source": "absent",
      "values": [],
      "sha256": []
    },
    "ui_operation_video": {
      "slot_id": "ui_operation_video",
      "role": "opaque_ui_demo",
      "kind": "video",
      "present": false,
      "valid": true,
      "source": "absent",
      "values": [],
      "sha256": []
    },
    "tail_video": {
      "slot_id": "tail_video",
      "role": "opaque_app_tail_card",
      "kind": "video",
      "present": false,
      "valid": true,
      "source": "absent",
      "values": [],
      "sha256": []
    }
  },
  "routes": {
    "product": "source_preserve",
    "character": "replace_from_slot",
    "ui": "source_ui_keep",
    "tail": "omit_source_end_card",
    "background_music": "none"
  }
}
